{
  "id": "light",
  "displayName": "light",
  "abnormalityResistanceBonuses": {
    "poison": 2,
    "burn": 2,
    "frostbite": 2,
    "cold": 2,
    "mud": 2,
    "electrocution": 2,
    "soaked": 2,
    "blind": 2,
    "curse": 2,
    "suddenDeath": 2,
    "paralysis": 2,
    "sleep": 2,
    "charm": 2,
    "fear": 2
  },
  "attributeResistanceBonuses": {
    "fire": 2,
    "water": 2,
    "thunder": 2,
    "earth": 2,
    "ice": 2,
    "wind": 2,
    "light": 2,
    "dark": 2
  }
}
